{
  "id": "6f1c2a4e-3b8d-4c1a-9e2f-0a1b2c3d4e02",
  "url": "https://bansos-kemensos.site/cek",
  "domain": "bansos-kemensos.site",
  "pageTitle": "Cek Penerima Bansos 2026",
  "faviconUrl": null,
  "score": 63,
  "status": "warning",
  "signals": [
    { "id": "asks_ktp", "layer": 3, "weight": 25, "label": "Form asks for KTP number", "labelSimple": "Asks for your ID card number", "evidence": "nik" },
    { "id": "cheap_tld", "layer": 2, "weight": 15, "label": "Cheap domain ending (.site)", "labelSimple": "This website address looks cheap and unofficial" },
    { "id": "brand_plus_keyword", "layer": 2, "weight": 13, "label": "Government name on non-official domain", "labelSimple": "Uses a government name but isn't a government site" },
    { "id": "urgent_language", "layer": 3, "weight": 10, "label": "Urgent language: \"terakhir hari ini\"", "labelSimple": "Rushes you to act fast" }
  ],
  "screenshotUrl": "https://example.invalid/screens/warning-63.png",
  "ownerDeviceId": "dev_me",
  "ownerName": "Adhella",
  "detectedAt": "2026-10-21T03:40:00Z",
  "verdict": null
}
