{
  "id": "6f1c2a4e-3b8d-4c1a-9e2f-0a1b2c3d4e05",
  "url": "https://tokokecil-batik.xyz/checkout",
  "domain": "tokokecil-batik.xyz",
  "pageTitle": "Checkout - Toko Kecil Batik",
  "faviconUrl": null,
  "score": 81,
  "status": "blocked",
  "signals": [
    { "id": "asks_card", "layer": 3, "weight": 30, "label": "Form asks for card number + CVV", "labelSimple": "Asks for your card details" },
    { "id": "new_domain", "layer": 2, "weight": 30, "label": "Domain age 9 days", "labelSimple": "This site was made 9 days ago" },
    { "id": "cheap_tld", "layer": 2, "weight": 21, "label": "Cheap domain ending (.xyz)", "labelSimple": "This website address looks cheap and unofficial" }
  ],
  "screenshotUrl": null,
  "ownerDeviceId": "dev_mom",
  "ownerName": "Mom",
  "detectedAt": "2026-10-19T08:00:00Z",
  "verdict": { "value": "safe", "byDeviceId": "dev_me", "byName": "Adhella", "decidedAt": "2026-10-19T08:03:00Z" }
}
